sec_source_id,title,subtitle,title_lang,person_id,genre_id,publication_place,publication_date,publishing_house,first_chin_edition,neibu,source_id,serial_part,pages,commentary,note,created,created_by,last_modified,last_modified_by
SS00245,那个时代没有远去,,zh,P0207,G03,,2011-09-13,Remembrance,,NULL,https://docs.google.com/document/d/1wf58KOyiWvweUUGZAk1bWG3QvmvF10_EM2tPeWGjEp4/edit#bookmark=id.ec963a2ae041,No 75,ONLINE SOURCE,by 马文蔚 about 九一三,,2018-02-27,MG,2018-02-27,MG
SS00246,,,en,P0033,G03,,2011-09-15,,,NULL,http://www.aisixiang.com/data/44238.html,NULL,ONLINE SOURCE,周孜仁 wrote it about 九一三,,2018-02-27,MG,2018-02-27,MG
SS00246,省委秘书记忆中的’九一三‘,,zh,P0033,G03,,2011-09-15,,,NULL,http://www.aisixiang.com/data/44238.html,NULL,ONLINE SOURCE,周孜仁 wrote it about 九一三,,2018-02-27,MG,2018-02-27,MG
SS00247,,,en,P0107,G02,,2014,,,NULL,SS00011,NULL,256-268 ,http://www.51papers.com/lw/70/26/wz218111.htm,,2018-02-27,MG,2018-02-27,MG
SS00247,芒克访谈,,zh,P0107,G02,,2014,,,NULL,SS00011,NULL,256-268 ,http://www.51papers.com/lw/70/26/wz218111.htm,,2018-02-27,MG,2018-02-27,MG
SS00248,A Single Tear,A Family‘s Persecution; Love; and Endurance in Communist China,en,P0281,G02,PL0050,1993,The Atlantic Monthly Press,,NULL,,,,,,2018-03-06,MG,2018-03-06,MG
SS00268,Vermilion Gate,,en,P0320,G03,PL0036,2000,Little; Brown and Company,,NULL,,NULL,,,,2018-03-17,MG,2018-03-17,MG
SS00269,Thirty Years in a Red House,A Memoir of Childhood and Youth in Communist China,en,P0310,G03,,1998,University of Massachusetts Press,,NULL,,,,,,2018-03-27,MG,2018-03-27,MG
SS00270,Let the Thought Brake the Cage,,en,P0348,G03,,,,,,SS00044,NULL,165-186,Translated by project member,,2018-04-09,MG,2018-04-09,MG
SS00270,让思想冲破牢笼,,zh,P0348,G03,,,,,,SS00044,NULL,165-186,,,2018-04-09,MG,2018-04-09,MG
SS00271,Youth Cannot Help,,en,P0362,G03,,,,,NULL,SS00044,NULL,507-530,Translated by project member,,2018-05-15,MG,2018-05-15,MG
SS00271,Qingchun wunai ,,zh-Latn-py,P0362,G03,,,,,NULL,SS00044,NULL,507-530,,,2018-05-15,MG,2018-05-15,MG
SS00271,青春无奈,,zh,P0362,G03,,,,,NULL,SS00044,NULL,507-530,,,2018-05-15,MG,2018-05-15,MG
